Page ID,Page Name,Disclaimer,Amount Spent (USD)﻿
357750373755,National Domestic Workers Alliance,National Domestic Workers Alliance,≤100
2038384559798492,Audrey For Judge,Friends of Audrey Victoria Cosgrove,≤100
472811836234923,Fred Akshar,Fred Akshar For Our Future,≤100
912954278819276,James Wood for Oconomowoc School Board,James P Wood,≤100
1001615463272722,Biosimilars Council,The Biosimilars Council,≤100
12301006942,Democratic Party,DNC SERVICES CORP./DEM. NAT'L COMMITTEE,≤100
103761441049549,Alex Yudelson,Friends of Alex Yudelson,≤100
756979391127754,NYU Teacher Residency Program,These ads ran without a disclaimer,≤100
2452905398272083,Froy Jimenez for Illinois Senate - 1st District,Froy Jimenez for Senate,≤100
32975139631,If Americans Knew,If Americans Knew,≤100
333649908729,Chatham Dems,Linda R Ziskind,≤100
9364828262,Citizens Against Government Waste,COUNCIL FOR CITIZENS AGAINST GOVERNMENT WASTE,≤100
1646680868683515,Better Roads For Olney,Bryce P Fehrenbacher,≤100
110813887040995,John D. Carter,John Derrek Carter,≤100
106294260864581,Clean Energy Transition Project,Clean Energy Transition Project,≤100
24470472733,The Trevor Project,The Trevor Project,≤100
7235567441,Tundra Books,These ads ran without a disclaimer,≤100
30914589895,The International Fellowship of Christians and Jews,"INTERNATIONAL FELLOWSHIP OF CHRISTIANS & JEWS, INC.",≤100
254805757891768,Naples Zoo at Caribbean Gardens,Naples Zoo,≤100
348948148522246,MHB - Men Having Babies,"MEN HAVING BABIES, INC.",≤100
750121728449001,Rebuild SoCal,Rebuild SoCal,≤100
325327944615052,11th District Councilmember Jennifer Reynolds,11th District Councilmember Jennifer Reynolds,≤100
80668957414,GoSili,SiliKids Inc.,≤100
105793837533545,Virginia Works,American Culture,≤100
754292894630067,GA Tax & Accounting Services,These ads ran without a disclaimer,≤100
538477226541042,First Primary Care,First Primary Care,≤100
298920260604,American Heart Association - Nebraska,American Heart Association,≤100
111585603642437,Angelito Tenorio for West Allis,Tenorio for West Allis,≤100
102039711269282,Jerry For Mayor,Friends of NewTown Party,≤100
1998005350416562,The Northeast Maglev,The Northeast Maglev,≤100
8145161702,Lambda Legal,"LAMBDA LEGAL DEFENSE & EDUCATION FUND, INC.",≤100
688952738225205,Your Plan. Your Advocate.,California Association of Health Plans,≤100
774883572691528,LLDM Justice,These ads ran without a disclaimer,≤100
170309409666124,Bellefontaine Cemetery and Arboretum,Linda Christine Gaal,≤100
101372334677493,Dancer Rights,Kristensen LLP,≤100
1191336950894416,City of Carlsbad NM Government,Social Media Manager,≤100
9890558205,New Era Colorado,New Era Colorado Foundation,≤100
405346683155169,Minnesota House DFL Campaign,DFL House Caucus,≤100
401547409864705,San Antonio Charter Moms,SAN ANTONIO CHARTER MOMS,≤100
1752211025000504,Wynona's House Child Advocacy Center,Senator Wynona Lipman Child Advocacy Center,≤100
160191644025128,Walton Family Foundation,WALTON FAMILY FOUNDATION INC,≤100
108777231824,Manhattan Institute for Policy Research,MANHATTAN INSTITUTE FOR POLICY RESEARCH INC,≤100
2294830990636604,Streets For All,Streets For All,≤100
158791100909689,Concerned Veterans for America,Concerned Veterans for America,≤100
170582513587720,Liberty Through Wealth,The Oxford Club,≤100
108597757264621,WOR HQ - Residential Green Energy,WOR HQ,≤100
102929747901911,Elect Lucila Flores for Judge of the 383rd District Court,Lucila Lorena Flores,≤100
87199812705,Advocates for Youth,ADVOCATES FOR YOUTH INC,≤100
116829365010689,Broward County Cultural Division,Broward County Cultural Division,≤100
132753914062,"Planned Parenthood of South, East and North Florida","Planned Parenthood of South, East and North Florida",≤100
355185097868461,Kathryn Starkey for Pasco County Commissioner,"Kathyrn Starkey, Republican, for Pasco County Commission, District 3",≤100
167686259995685,Shen Yun,These ads ran without a disclaimer,≤100
316498251698370,Adam Gray for Assembly,Gray for Assembly 2020,≤100
184790518234668,Roxbury Township Public Library,These ads ran without a disclaimer,≤100
113768726839528,Joseph Kishore,Bryan Joseph Scherrer,≤100
107870514095323,For a Better Ventura County,For a Better Ventura County,≤100
25121889784,Texas Public Policy Foundation,Texas Public Policy Foundation,≤100
102054351411803,Texans United Against Corruption,These ads ran without a disclaimer,≤100
207182546557721,Anjana Samadder,These ads ran without a disclaimer,≤100
16266289036,International Campaign for Tibet,These ads ran without a disclaimer,≤100
2602473023098666,Democratic Polling Center,Democratic Governors Association,≤100
384676381708957,Education NC,Education NC,≤100
103610104468794,Octavio Dominguez for Judge,Campaign for Octavio Dominguez,≤100
110312563826283,SadEarth,SADEARTHBRAND,≤100
115848097551,Institute for Women's Policy Research,Institute for Women's Policy Research,≤100
28144169620,Alliance for Aging Research,Alliance for Aging Research,≤100
888123531223968,EdChoice Kentucky,EdChoice Kentucky,≤100
322771814739545,Everyone In LA,"UNITED WAY, INC.",≤100
1555589474666782,Devon J. Mathis For Assembly,Devon Mathis for Assembly 2020,≤100
159274144426567,MAS Quran Institute,MAS CHICAGO NFP,≤100
236142560669642,Mark Alcarez for Douglas County Coroner,Mark Alcarez for Douglas County Coroner,≤100
104242142960296,Marc Lopez Law,Marcelino Gustov Lopez,≤100
229358837936619,"Janet Yang Rohr - For IL State Representative, 41st District",Friends of Janet Yang Rohr,≤100
101297867923420,Jeff Foster for Superior Court Judge,Jeff Foster for Superior Court Judge,≤100
105023768642,U.S. Chamber Institute for Legal Reform,US Chamber Institute for Legal Reform,≤100
1165122570296957,Phoenix Zones Initiative,These ads ran without a disclaimer,≤100
114274493350512,Georgia Alliance for Community Hospitals,Georgia Alliance for Community Hospitals,≤100
1417599265225727,Southwestern Medical Foundation,Collin M Quick,≤100
210820618956311,Community Change Action,Center for Community Change Action,≤100
109255783924810,Carlin for Judge - Court of Appeals,Hugh A Carlin,≤100
1073830786000906,Cody Vasut for State Representative,Cody Vasut,≤100
107769029247935,Magee-Womens Research Institute & Foundation,Magee-Womens Research Institute & Foundation,≤100
8127889355,Americans for Tax Reform,Americans for Tax Reform,≤100
111111360297173,Meg Loughran Cappel For IL State Senate 49th,Committee to Elect Meg Loughran Cappel,≤100
1615018905412860,Progressive Turnout Project,PROGRESSIVE TURNOUT PROJECT,≤100
226606004500820,Wesley Blankenship for WV State Senate,Wesley Garrett Blankership,≤100
102257621221526,Darrell Hull for Parker County Sheriff,Darrell Wade Jr Hull,≤100
259130650776119,Mitch McConnell,MCCONNELL SENATE COMMITTEE,≤100
7474340746,Human Rights First,HUMAN RIGHTS FIRST,≤100
1225805744242299,Chad Bordelon for Mandeville Mayor 2020,Chad B Bordelon,≤100
153171891404218,Common Sense Policy Roundtable Forum,Common Sense Policy Roundtable Forum,≤100
83290028957,Care Net,CARE NET,≤100
104741474400535,Katherine Hurst for DSCC District 43A Representative,Katherine L Hurst,≤100
136769859682655,Derek Schmidt,"Schmidt for Attorney General, Inc.",≤100
822386221184282,Jeremy Karlin for Knox County State's Attorney,Friends of Jeremy Karlin,≤100
478486236022342,Fanita Ranch,Fanita Ranch,≤100
1379912528970300,Assemblyman James Gallagher,Gallagher for Assembly,≤100
101860364658541,Michael Johnson for Senate,Michael Johnson for Senate,≤100
105132824441437,Dan at Seymour Chamber,These ads ran without a disclaimer,≤100
10760692978,World Hope International,World Hope International,≤100
108879057120462,Susan Collins for City Council 2020,Collins for City Council 2020,≤100
186932688457686,CHNGE,CHNGE,≤100
372847379421329,"NeSmith Immigration Attorneys, LLC","NeSmith Immigration, LLC",≤100
394317154459785,Jeff Moore For NC House,Jeff Moore For NC House,≤100
140535092684277,Long Island Green Homes,Sustainability Institute at Molloy College,≤100
171803459564318,Janet's Floral Design & A New Song WildBird and Garden Center,These ads ran without a disclaimer,≤100
115312693343704,Noschoolbonds.com,Fullerton Taxpayers for Reform,≤100
1629925673968109,Refuse Fascism,Refuse Fascism,≤100
173783582668940,Lyda Ness-Garcia - Advocate,Campaign to Elect Lyda Ness Garcia,≤100
84280132559,American Legislative Exchange Council,AMERICAN LEGISLATIVE EXCHANGE COUNCIL,≤100
310925405807,Citizens Climate Lobby,Citizens' Climate Lobby,≤100
140384046004597,Water Mission,Water Mission,≤100
2419497711615063,PDX VEG,Catherine Hester Berlot,≤100
469905999826004,Concealed Az,Concealed Az,≤100
106574022825492,Idaho Second Amendment Alliance,Idaho Second Amendment Alliance,≤100
115280186553725,Friends of Joe Duplechin,Friends of Joe Duplechin,≤100
17274984050,Consumer Reports Advocacy,Consumer Reports Inc,≤100
1590965647784736,CWA District 1,"COMMUNICATIONS WORKERS OF AMERICA, AFL-CIO, CLC",≤100
77459136187,Gavin Rollins,GAVIN ROLLINS FOR CONGRESS,≤100
1555020631394957,American Jewish University - AJU,American Jewish University,≤100
1349171708448303,Bags For Good,Beverley Yehuda,≤100
107138134194460,Go Bend 2020,Gavin Claxton Mahaley,≤100
160082424028807,American Heart Association - Ft. Lauderdale/Miami,"American Heart Association, Inc.",≤100
104127571175233,Judge Jay McCallum,Judge Jay McCallum Campaign Committee,≤100
391523854240149,Tim Knopp,Tim Knopp for State Senate,≤100
1661332784149884,"Willie Ng, MPA",Willie 4 Sheriff,≤100
580817989082746,UnRestrict Minnesota,UnRestrict MN,≤100
522729871086848,doNYC,These ads ran without a disclaimer,≤100
134571176638205,One Tree Planted,One Tree Planted,≤100
184272833618,City of Las Vegas Government,City of Las Vegas,≤100
112322706858707,Veles Co.,These ads ran without a disclaimer,≤100
79125112926,Students for Life of America,These ads ran without a disclaimer,≤100
551328948361758,For Our Future WI,For Our Future Action Fund,≤100
107142210865623,Elect Vincent Cuevas for State Representative 92nd District,the Committee to Elect Vincent Cuevas,≤100
328783261284553,Marsy's Law for Tennessee,Marsy's Law for Tennessee,≤100
502188880524161,"Commissioner Ty Penserga, City of Boynton Beach, District 4","Ty Penserga for Boynton Beach Commission, District 4",≤100
108118582602630,Home Again St. Johns,Home Again St. Johns,≤100
105105017698613,Friends for Judge Marubio,Dontien S Ingram Moore,≤100
111697590178271,Andy Hires for State Representative 109th District,Friends of Andy of Hires,≤100
147670899078,Boys & Girls Clubs of Chicago,These ads ran without a disclaimer,≤100
109635080576212,Friends of the Riverfront,Friends of the Riverfront,≤100
110261003863999,Grow Smart LI,The Good Growth Alliance,≤100
107863804082751,Pam Haynam for Recorder,Pamela Haynam Haynam,≤100
106211660885207,Cabrillo - Yes on R,Friends of Cabrillo College 2020 – YES on R,≤100
152264148166020,Moms Clean Air Force,Moms Clean Air Force,≤100
41769369717,United Way of Tucson and Southern Arizona,"UNITED WAY OF TUCSON AND SOUTHERN ARIZONA, INC.",≤100
339008335523,Hammerle Finley Law Firm,These ads ran without a disclaimer,≤100
1848736018679978,Fight For 46 Political News and Tees,Tobin Laurence Jones,≤100
330617944306531,Jerica Richardson,Jerica Marie Richardson,≤100
417542331752173,Message,Timothy Bruce Dannunzio,≤100
111104088916258,Office of Hawaiian Affairs,Office of Hawaiian Affairs,≤100
200337413510901,Village of Matteson Trustee Adam Shorter III,Adam Shorter Iii,≤100
100633308217473,Justice For Sara,Justice For Sara,≤100
17382403969,"The Lesbian, Gay, Bisexual & Transgender Community Center","LESBIAN & GAY COMMUNITY SERVICES CENTER, INC.",≤100
109439487300898,Thales Academy Franklin,Rachael Ferrell Bradley,≤100
240129046467184,Supervisor Joseph Saladino,Citizens for Saladino,≤100
2037938779622595,Tina Arias Miller for Democratic Party OC Central Committee - AD 68th Dist.,"Tina Arias Miller Central Committee, AD68 Democratic Party, FPPC#1424994",≤100
2205129203148606,Seth Hettena,Seth Jonathan Hettena,≤100
140499052681592,Bank of the West,BANK OF THE WEST,≤100
1335225583265331,Independent Oil and Gas Association of West Virginia,"Independent Oil and Gas Association of West Virginia, Inc.",≤100
103666681209850,Mike Heckmann for State Representative,Friends of Mike Heckmann,≤100
102037361257173,Daniel J. Weckesser for Knox County Sheriff,Committee to Elect Daniel J. Weckesser,≤100
1468249340056024,Passaic County Young Republicans,Donald S Dedio Jr,≤100
1485218291794760,Re-Elect Supervisor Debbie Arnold 2020,Debbie Arnold for Supervisor 2020,≤100
7263476274,Mercy Corps,Mercy Corps,≤100
205693312974273,Tyler Servant,Servant Campaign Fund,≤100
85620546149,Paul Simon Public Policy Institute,Paul Simon Public Policy Institute,≤100
526163704576977,Keep Judge Patrick Devine,Patrick Joseph Devine,≤100
175170619192552,James D. Diamond,James David Diamond,≤100
1012844478903955,Permeating Light Project,Lady Donna Dutchess,≤100
484059238785801,"Erin Zwiener, Texas State Representative",Erin Zwiener for Texas House,≤100
101419314659505,William for Oregon,William Dean Miller,≤100
350385952352374,Eric Ryan Anderson Republican Candidate for Sumter County Sheriff,The Bauen Group,≤100
682555508619370,Wake Up Atlanta,"ASIAN AMERICANS ADVANCING JUSTICE-ATLANTA, INC.",≤100
186666348590362,Collin County Votes,Collin County Business Alliance,≤100
160645331112654,David Smith for State Representative,David Smith for State Representative,≤100
265915710125206,The Nature Conservancy in California,Nature Conservancy,≤100
101999954678749,Jim Norton for Mayor,Jim Norton For Mayor,≤100
103075761295528,Miguel Pulido for O.C. Supervisor,Miguel A. Pulido for Supervisor 2020,≤100
1148292668573296,Bernie 2020,Robin Alana Crabtree,≤100
1135371009958405,Melissa Morris for Texas Senate,Morris For Texas Senate District 13,≤100
54580146753,Faith in Action,Faith in Action,≤100
911845658833043,I Am An Immigrant,FWD.us Education Fund,≤100
1210309259055520,Package Free,These ads ran without a disclaimer,≤100
6096369029,Comedy Central,Comedy Central,≤100
151240148401954,County of San Luis Obispo Government,These ads ran without a disclaimer,≤100
153080620724,Donald J. Trump,"DONALD J. TRUMP FOR PRESIDENT, INC.",≤100
46053668697,ACLU of Northern California,ACLU of Northern California,≤100
1290536624348001,Informed Immigrant,FWD.us Education Fund,≤100
101297468108636,Michael Harry Minton for Judge,Citizens for Minton,≤100
724263814668980,美国移民律师 Gary J. Kim,Law Offices of Gary J. Kim,≤100
121722247664,Planned Parenthood Keystone,These ads ran without a disclaimer,≤100
245939272100347,Act Locally Waco,Sharron Ashley Thornton,≤100
630841967406196,StepChange Clothing,Joseph Harry Wagner,≤100
1181105015356858,Ron Wright,Ron Wright for Congress,≤100
151224311736267,PSEG Long Island,PSEG Long Island,≤100
277005566267077,Blueland,Blueland,≤100
801168856602067,Shadyside Church of Christ,Richard Joseph Zumpano,≤100
281592708607677,Lafayette Parish Republican  RPEC  District 1  Denice Comeaux Skinner,Denice C Skinner,≤100
1316372698453411,Alexandria Ocasio-Cortez,ALEXANDRIA OCASIO-CORTEZ FOR CONGRESS,≤100
949106395170846,"Kevin Shutty for Mason County Commissioner, Dist.2",Kevin Sean Shutty,≤100
113330620093147,Sunny for Congress,Suneetha Chaparala,≤100
123676835699406,Adam Niemerg for State Representative for 109th District,Committee To Elect Adam Niemerg,≤100
107857334148826,Virginia Planning District 16 Census Awareness,Gregory Verne Swanson,≤100
115132053208625,Muskegon Sun,Metric Media LLC,≤100
1339263056165744,Telemundo 20 Directo Al Consumidor,These ads ran without a disclaimer,≤100
53167307346,Communist Party USA,Communist Party USA,≤100
210368456477,Vermont Natural Resources Council (VNRC),Vermont Natural Resources Council,≤100
40094923604,ACLU of Texas,ACLU of Texas,≤100
132492254050920,American AF,AAF Nation,≤100
402488163467483,Charleston FYI,Awesome News Network,≤100
245815932119105,Wilton Simpson,Jobs for Florida,≤100
287694681754849,Pennsylvania Conservative Energy Forum,Pennsylvania Conservative Energy Forum,≤100
108589300633922,Oklahoma Federation for Children,Oklahoma Federation for Children,≤100
102641321233918,Stop Maduro,Humano y Libre,≤100
795601923917961,Better Place Forests,Better Place Forests,≤100
175723919259349,Mayor Scott Singer,Scott Singer for Mayor,≤100
1387062348242626,ProgressNow Arizona,ProgressNow AZ,≤100
100498434891964,Yraida Aponte-Lipski for Freeholder,Nicholas P Jayme,≤100
16477459734,League of Conservation Voters,"LEAGUE OF CONSERVATION VOTERS, INC",≤100
148205145252473,Backcountry Hunters & Anglers,Backcountry Hunters & Anglers,≤100
429851780486352,Old Astoria Neighborhood Association,OLD ASTORIA NEIGHBORHOOD ASSOCIATION INC.,≤100
237224053850789,Mobile Workers Alliance,Mobile Workers Alliance,≤100
113657099992344,Sweeten Lemon Grove,Save Lemon Grove - Yes on S,≤100
595852920547745,"Law Office of Yuriy Moshes, P.C.",These ads ran without a disclaimer,≤100
39920145674,"City of Lawrence, Kansas - Municipal Government","City of Lawrence, Kansas",≤100
334948653188197,Mazzoni Karam Petorak & Valvano,Mazzoni Karam Petorak & Valvano,≤100
341135582616840,Blue Sky Creative Studio,These ads ran without a disclaimer,≤100
194215234005640,Tyler McBroom,These ads ran without a disclaimer,≤100
840998846269229,Richard Rowe for Congress,Richard Allen Rowe,≤100
11911627997,Pancreatic Cancer Action Network,"PANCREATIC CANCER ACTION NETWORK, INC.",≤100
462073343997591,Suzie Health Solutions,Matthew Alexander Mccolm,≤100
107803807306401,Michigan Census,Michigan Census 2020,≤100
76625396025,CDC,These ads ran without a disclaimer,≤100
239880129983455,California Term Limits,U.S. Term Limits Inc.,≤100
1711605449154098,Rosedale Oral History Project,Cody Patrick Mcdevitt,≤100
497433567299699,Overstreet 2020,David Overstreet 2020,≤100
405381432827374,Pierce County,Pierce County Human Services,≤100
485951371457440,Texas Gun Rights,Texas Gun Rights,≤100
351310239372,Associated Republicans of Texas,Associated Republicans of Texas,≤100
112844556967987,Re-Elect Mayor Danny Jones - South Congaree,Kelehear Dickerson Jones,≤100
109339580684861,Boy Scouts of America Abuse Claims,These ads ran without a disclaimer,≤100
165350426309,Goodwill Industries of Tulsa,"GOODWILL INDUSTRIES TULSA, INC.",≤100
431099560800970,Front Page Live,"Front Page Live, Inc.",≤100
349088905485835,Round-Up Claims,These ads ran without a disclaimer,≤100
162695894106234,Co-ops Vote,National Rural Electric Cooperative Association,≤100
103974389650244,Amenders for Federal Spending Control,Mark Albert Meier,≤100
101011374703725,Dr. William Figlesthaler,WILLIAM FIGLESTHALER FOR CONGRESS,≤100
101985014730549,"Ian and Bridget for UIUC; All for I, and I for All",Ian Katsnelson,≤100
11131463701,truth,TRUTH INITIATIVE FOUNDATION,123
1708467695859543,Veteran Transition Mission,Sonia Ivelisse Barriera Ayala,≤100
128684033879885,Alabama Optometric Association,Kristine Marie Jacobs,≤100
2363271500609808,Armitage For Congress,ARMITAGE FOR CONGRESS,≤100
106630624112608,Vote Mark Sheldon,Mark Sheldon for Panama City Beach Mayor,≤100
341858589449,Save Bristol Bay,"TROUT UNLIMITED, INC.",≤100
153588847304,UNITE HERE Local 1,UNITE HERE Local 1,≤100
502528666480497,Kiss The Ground,KISS THE GROUND,≤100
170458177029365,Delegate Heather Bagnall,Citizens For Heather Bagnall,≤100
102852527846130,Navarro4Neighbors,Neighbors for Ruben Navarro City Council District 6-2020,≤100
1632866270065962,Jewish Democratic Council of America,Jewish Democratic Council of America,≤100
108505303942541,Now Hear Me Out Podcast,Now Hear Me Out Podcast,≤100
163055010716637,G95,Peter Carlton Solle,≤100
105191560863460,Judge Emily Sutton,Citizens for Judge Emily Sutton,≤100
39897949829,Texas Watch,TEXAS WATCH,≤100
109021767293838,Making Retirement Last,Making Retirement Last,≤100
110837910261045,HABERSHAM For US For Congress,RICHARD PARNELL HABERSHAM FOR CONGRESS,≤100
156441914406813,Larry Hug For Illinois Senate Dist. 49,Friends for Larry Hug,≤100
114349990014650,"Adam Ganz for District Court Judge, Dept. 3",Adam Ganz,≤100
215968684159,AFT - American Federation of Teachers,American Federation of Teachers,≤100
1799282383731277,TwoSeventy,Alexander Jared Deutsch,≤100
103986457843247,Okay To Say No,Sensible Solutions for New Phila,≤100
383821768741044,Dr. Steve Woodsmall,Woodsmall for Congress,≤100
104707767821415,Adam Andre Elkhorn School Board,Charles Adam Andre Iii,≤100
121624801200841,"Professional Firefighters/Paramedics of Palm Beach County, Local 2928 IAFF","Professional Firefighters / Paramedics of Palm Beach Beach County, Local 2928",≤100
112735922758892,Charlie Kirk,"Premiere Marketing, Inc.",≤100
104010744313600,Vote Ben Pogue,Ben Pogue for Solicitor LLC,≤100
105175422857231,Association of American Railroads,ASSOCIATION OF AMERICAN RAILROADS,≤100
14413545701,Conservation Law Foundation,"CONSERVATION LAW FOUNDATION, INC.",≤100
336020867045939,Dr. Ravi for TUSD,RAVI P GRIVOIS-SHAH,≤100
2108414729422207,New Energy Now PA,Energy Media,≤100
11791104453,NRDC,Natural Resources Defense Council,≤100
1765928220295758,Judge Deborah Geraldine Bledsoe Ford,Deborah Geraldine Ford,≤100
109784800371914,Protect Kids: Fight Flavored E-Cigarettes,TOBACCO-FREE KIDS ACTION FUND,≤100
111663158887300,Tacoma Rescue Mission,"RESCUE MISSION, THE",≤100
1700622986725945,"Luke Orlando, Pearland Councilman",Councilman Luke Orlando,≤100
163148530407080,Captain Mark Kelly,MARK KELLY FOR SENATE,≤100
1722872318024029,Great Lakes Business Network,Great Lakes Business Network,≤100
1037157259782946,Colorado Way,The Story of Us,≤100
482902621746064,New Schools for Baton Rouge,New Schools for Baton Rouge,≤100
120522437962280,Hutchins Center for African & African American Research,The Hutchins Center for African & African American Research at Harvard University,≤100
120137368013775,Puget Sound Energy,"PUGET SOUND ENERGY, INC.",≤100
107858693983382,The GOP Shop,The GOP Shop,≤100
93228695778,Tea Party Patriots,Tea Party Patriots,≤100
510680265702016,Crowned Free,Crowned Free,≤100
15687409793,World Wildlife Fund,World Wildlife Fund,≤100
11111618026,Union of Concerned Scientists,"UNION OF CONCERNED SCIENTISTS, INC.",≤100
383877235817031,Keep America Great,Keep America Great,≤100
100702368196273,The Trump Store,Misty Mechelle Mercado,≤100
106469240890813,Military Support,Whats Your Injury Worth,≤100
1556323534653761,Richard Attias & Associates,Richard Attias & Associates,≤100
140978009255170,Leon County,Leon County Government,≤100
682208958556073,Rx in Reach Georgia Coalition,Rx in Reach Georgia Coalition,≤100
1932661483717991,Theresa Mah,Friends of Theresa Mah,≤100
1018914308173454,FStop Foundation,"FSTOP FOUNDATION INC, THE",≤100
104933662932387,CreativeFuture,CreativeFuture,≤100
104337644377585,Damian Sonsire for County Court Judge,Committee to Elect Damian Sonsire,≤100
199826043375900,Larry Hogan,Change Maryland Action Fund,≤100
107477257479850,GA for Mike,Mike Bloomberg 2020 Inc,≤100
1880507922255279,Question PAC,QUESTION PAC,≤100
355552734797587,TruePublic,These ads ran without a disclaimer,≤100
1548467052116987,Nichols for Idaho,Tammy  Nichols,≤100
130576050396299,Rhodesia Ransom for Supervisor,Rhodesia Ransom for Supervisor,≤100
196191740408148,Association of Oil Pipe Lines (AOPL),Association of Oil Pipe Lines,≤100
172756986111825,Capsa,"CITIZENS AGAINST PHYSICAL AND SEXUAL ABUSE, INC.",≤100
1725625867652270,Stacy Kuper for County Council,Anastasia Anthony Kuper,≤100
1654601441477283,Maggie O'Keefe,Friends of Maggie O'Keefe,≤100
101907604721693,Charles Ewell for Jackson County State's Attorney,Committee to Elect Charles Ewell,≤100
101895607980616,Newsday Headlines,PETER-GAY NIKORA LINDO,≤100
102693327778907,Advocates for Life at the University of South Carolina,Advocates for Life,≤100
102646114629176,Boomer Wright,Friends of Boomer Wright,≤100
464730144317682,Blake Sullivan for Mayor of Macon-Bibb,BLAKE SULLIVAN COMMITTEE TO ELECT FOR MAYOR,≤100
149745555082419,Pioneer Institute for Public Policy Research,"Pioneer Institute, Inc.",≤100
919078151815854,Marsy's Law for Mississippi,"Marsy’s Law for Mississippi, LLC",≤100
939178609493341,Clint Erickson Holmes County Commissioner District 5,Clint Matthew Erickson,≤100
862521063868287,Chris Wallace for Madison County Commissioner,Christopher A Wallace,≤100
640792746274736,Hollywood Village,Church of Scientology Celebrity Centre International,≤100
102198711338906,3M Claim Support,These ads ran without a disclaimer,≤100
110943747167218,Valerie Turnbow for Lovejoy ISD,Howard Bryce Greene,≤100
620882164603697,Cover Virginia,These ads ran without a disclaimer,≤100
160750304063986,Washington Housing Alliance Action Fund,Washington Housing Alliance Action Fund,≤100
1087474374640616,Vocal,"Vocal Ventures, LLC",≤100
1632583763671130,Stacey Evans,Friends of Stacey Evans,≤100
2239612502972248,Friends of Car-Free Key West,Christopher Robert Hamilton,≤100
10803722213,Common Cause,COMMON CAUSE,≤100
245711905631405,Jeff Jackson,Jeffrey Jackson,≤100
1024984580892392,Josh Gottheimer for Congress,JOSH GOTTHEIMER FOR CONGRESS,≤100
233761700107851,The Alliance for Solar Choice,The Alliance for Solar Choice,≤100
1320005784826065,Dora Villarreal for State's Attorney,Friends of Dora Villarreal,≤100
30139072158,CARE,CARE,≤100
522652384563753,Ohio Gun Owners,Ohio Gun Owners,≤100
