Page ID,Page Name,Disclaimer,Amount Spent (USD)﻿
111745270370179,Michigan Land and Liberty Coalition,These ads ran without a disclaimer,≤100
1315979478553339,Emiliano Vera for State Representative IL93,Working Families for Emiliano Vera,≤100
487571108071357,North Carolina Coalition for Fiscal Health,North Carolina Coalition for Fiscal Health,≤100
566897360481398,Tom Brier for Congress,BRIER FOR CONGRESS,≤100
384336778589668,Defend Our Constitution,COMMON CAUSE,≤100
410290069752420,Elect Jordan Ridley to GA House District 20,Jordan Christopher Ridley,≤100
1400371370253041,Eagan Immigration,Eagan Immigration,≤100
2352630938293825,Mytacticalpromos,Entremax,≤100
134256654140,Bob Davis,The Bob Davis Podcasts,≤100
155875451219691,Wisconsin LGBT Chamber of Commerce,Wisconsin LGBT Chamber of Commerce,≤100
251499331992885,VA Claim Pros,These ads ran without a disclaimer,≤100
497244950291938,Brian Strickland for Georgia,Strickland for Georgia,≤100
148301425595,Goodwill of Southwestern Pennsylvania,GOODWILL OF SOUTHWESTERN PENNSYLVANIA,≤100
367854770014260,Krishna Bansal,KRISHNA FOR CONGRESS,≤100
59512067962,Housing Opportunities Made Equal of Virginia (HOME),"HOUSING OPPORTUNITIES MADE EQUAL OF VIRGINIA, INC",≤100
314934432050445,Keeping Our Promise - Rochester,Ellen Elisabeth Smith,≤100
595698803841943,State Rep. John Viola,Delaware House Democratic Caucus,≤100
27510364468,Science History Institute,SCIENCE HISTORY INSTITUTE,≤100
101286161432946,Anna Kasachev,Friends of Anna Kasachev,≤100
445183325941421,"1-833 Ask-Shel, LLC",These ads ran without a disclaimer,≤100
192737024112371,TWU Local 556,Transport Workers Union Local 556,≤100
636744303193946,Carlos Diaz - Safety Harbor Commissioner,"Carlos Diaz, Nonpartisan, For Safety Harbor City Commission, Seat #4",≤100
113231603545224,Durden for District Judge,Todd Alan Durden,≤100
214109952097486,Keep Bryan Beavers Kaufman County Sheriff,Bryan Wallace Beavers,≤100
102047517918,The Commonwealth Fund,"COMMONWEALTH FUND, THE",≤100
245152275619372,FloridaPolitics,Florida Politics,≤100
2291522820927744,J Hanley For State's Attorney,Friends of J. Hanley,≤100
212383329324759,Dan Lipinski for Congress,DAN LIPINSKI FOR CONGRESS,≤100
116426366486,AAUW,American Association of University Women Inc,≤100
6485101073,Tides,Tides Foundation,≤100
117684604922023,Regional Recycling and Waste Reduction District,Regional Recycling and Waste Reduction District,≤100
114622329920,Law Offices of Dean Malone,LAW OFFICES OF DEAN MALONE PC,≤100
1234251319933440,Exclusive Apparel,The Dude's Designs,≤100
297108030389933,NOVL,These ads ran without a disclaimer,≤100
851152471658846,The Free Enterprise Club,Arizona Free Enterprise Club,≤100
389119978332258,We Are Apartments,The National Association of Apartments and the National Multifamily Housing Council,≤100
121744079222155,Oregonians for Clean Air,Oregonians for Clean Air,≤100
138876992797995,Pura Vida Bracelets,These ads ran without a disclaimer,≤100
2259974450909783,Michael Echols for Louisiana,"YourVote, LLC",≤100
101568761447230,Compensation Experts USA,Injury Compensation Center,≤100
106691907452893,Judge Judy Cates for Illinois Supreme Court,Judge Judy Cates for Supreme Court,≤100
852187284832856,"City of Cookeville TN - Ricky Shelton, Mayor",Michael Richmond Shelton,≤100
189758874031,Outside TV,"OUTSIDE TELEVISION, INC.",≤100
1963834227223718,Britt Raybould for Idaho,Britt Raybould for Idaho,≤100
1660659150840790,Chicago Unheard,Chicago Unheard,≤100
1892022607699008,Cocky Trump,Freedom Fighters USA,≤100
1836138529938551,Greater Half,Greater Half,≤100
110398490470951,Stephen Musselman  Progressive for Howard County Circuit Court Judge,Stephen Joseph Musselman,≤100
170187609795,Pinellas County Government,Pinellas County,≤100
2469990016562535,John Grimm for Kootenai County Sheriff,John Grimm for Kootenai County Sheriff,≤100
1651376218448809,"Parker Destin for Okaloosa County Commissioner, District 5","Parker Destin for Okaloosa County Commissioner, District 5",≤100
59826489083,SELC,SOUTHERN ENVIRONMENTAL LAW CENTER,≤100
103131054573692,Crawfordology,Crawfordology,≤100
562899883740849,New York Conference of Mayors,New York State Conference of Mayors,≤100
331925617426439,Wesley Davis Property Appraiser of Indian River County,Indian River County Property Appraiser,≤100
417335028351221,Senator Scott Wilk,Senator Scott Wilk,≤100
112739086975178,Big Tent Project,Big Tent Project Fund,≤100
113989033336945,Jami Cate for State Representative,Friends of Jami Cate,≤100
222811984421691,Cold Bee Gone,Joyce K C None Dales,≤100
187193381384216,Fair Housing Center of Southwest Michigan,These ads ran without a disclaimer,≤100
105927380981385,Marilyn Wood for Iron County Commissioner,Friends of Marilyn Wood,≤100
104117891137180,Everyday is a Second Chance,Shi Yuan Ge,≤100
1977575225902318,Goodwin For Vigo County Commissioner,Goodwin for Terre Haute,≤100
101756717903904,Re-Elect Joel Blue for Prosecutor,Joel M Blue,≤100
1650750011823701,NYS Senate Republican Campaign Committee,New York State Senate Republican Campaign Committee,≤100
98830223822,Stillwater Public Library,These ads ran without a disclaimer,≤100
114943369877295,Floors Outlet,Brian Elliot Mcdonald,≤100
112293620121868,"Mora Area $60,000,000 Bond Referendum Info Page",These ads ran without a disclaimer,≤100
19972147679,SEIU,SEIU,≤100
107725370798378,"Texas Federation for Children PAC, Inc.","Texas Federation for Children PAC, Inc.",≤100
2197543200459333,One Country Project,One Country Inc,≤100
112942500238297,Trees4Australia,Trees4Australia,≤100
1754034854890885,Joseph Sanchez for Congress,JOSEPH SANCHEZ FOR CONGRESS,≤100
290138361179721,The Female Quotient,These ads ran without a disclaimer,≤100
109891623929786,Jonathan Cable for Lincoln County District Attorney,Jonathan Harper Cable,≤100
107078204155592,Bama News Now,David Leonard Preston,≤100
249220035141307,Planned Parenthood of Indiana and Kentucky,Planned Parenthood of Indiana and Kentucky,≤100
334100227202941,Lynnwood Times,Lynnwood Times,≤100
70090474914,American Farmland Trust,"AMERICAN FARMLAND TRUST, INC",≤100
101087218106555,Cameron McCreary For Dearborn County Coroner,Bridget Niccole Mccreary,≤100
1676473152624146,Daniel Dietch,Daniel Dietch Campaign,≤100
557113921291144,Learning Dynamics,4 Weeks To Read LLC,≤100
281564034037,AARP Hawaii,AARP,≤100
460236704351535,Tracy Mitrano,TRACY MITRANO FOR CONGRESS,≤100
1883837055193241,Shield Republic,Shield Republic,≤100
834645469890446,Devin Nunes,DEVIN NUNES CAMPAIGN COMMITTEE,≤100
327011024831097,Ruth Wyman for Circuit Judge,Ruth Wyman for Cicuit Judge,≤100
137890193481108,Water Grows,CORN PRODUCERS ASSOC OF TX,≤100
123041607822419,Learn Russian in the European Union,These ads ran without a disclaimer,≤100
612308568954383,Goldilocks Wraps,These ads ran without a disclaimer,≤100
106172714114950,Champer for Commissioner,Darrell Eugene Champer,≤100
248775065305797,Black Butte Copper,Sandfire Resources America,≤100
256570454452074,Michael O'Donnell for Sedgwick County,Michael O'Donnell for Sedgwick County,≤100
107626047540927,Veteran Earplug Claims,My Earplug Injury,≤100
608862422970723,Fishermen for Trump,William Edward Regan,≤100
170143182874,Run for Clean Air,DELAWARE VALLEY CITIZENS COUNCIL FOR CLEAN AIR,≤100
349565108394619,Tim Fox,Fox for Governor,≤100
276967979123378,Dario Anselmo for Hennepin Commissioner,Dario Anselmo for Commissioner,≤100
1637903659798131,Dr. Jay Kinzler,KINZLER FOR CONGRESS,≤100
143986912311328,University of Vermont Continuing and Distance Education,University of Vermont,≤100
2956033207756237,Nora Vargas for County Supervisor,"Nora Vargas for County Supervisor 2020, FPPC ID# 1414915",≤100
58895145877,"Village of Oak Park, Illinois",Erik Jacobsen,≤100
704921686633153,Havurah of the Desert,These ads ran without a disclaimer,≤100
86217603869,"The Goulding Agency, LLC",Paul George Goulding,≤100
102286039830596,SEIU Local 49,SERVICE EMPLOYEES INTERNATIONAL UNION LOCAL 49,≤100
109900587212303,Fix Williamstown Township Roads,Residents to Fix Williamstown Township Roads,≤100
103434887838505,2020 Census,Mobile County Commissioners,≤100
109529977080964,Miller4Judge,Luke Camara,≤100
1669478099957076,State Representative Dan Flynn,Dan Flynn Campaign Fund,≤100
100486426663199,Florida Skin Center,Florida Skin Center,≤100
106120240940046,Zaehringer 4 Judge,George Martin Zaehringer,≤100
105354227604934,Shannon Bruce for Mayor,Shannon Bruce For Mayor Committee,≤100
106977800657570,Everyone In Long Beach,"UNITED WAY, INC.",≤100
100587334782379,The Heart of Bastrop,Tammy Pyles Johnson,≤100
108994915821589,ReThink Energy Florida,ReThink Energy Florida,≤100
664287716946897,The Refuge for DMST,THE REFUGE FOR DMST,≤100
283053323001,Judge Jeff Rose,Chief Justice Jeff Rose,≤100
107030182653162,The James Irvine Foundation,These ads ran without a disclaimer,≤100
471662392942995,Delegate Jheanelle Wilkins,Friends of Jheanelle Wilkins,≤100
101878191305861,Rodney Casteel for North Rock Creek,Rodney Dale Casteel,≤100
1903981929862784,Judge Sarah Smith for Appellate Court,Sarah Smith for Appellate Court,≤100
2241235272662760,Jeremy Evans,Steve Verzwyvelt Jr.,≤100
800200833439539,"Congressman Greg Murphy, MD",Office of Congressman Greg Murphy,≤100
555787351119974,Coalition to Protect America's Health Care,Coalition to Protect America's Health Care,≤100
104745474214057,HRA - OTC Birth Control,Corey Francis Mc Govern,≤100
102263111314148,Devin Wright for DSCC & DPEC,Devin James Wright,≤100
100151061609410,Resist Trump,These ads ran without a disclaimer,≤100
565904740563298,Cody Rogers for State Senate,Cody Rogers For State Senate,≤100
27713232096,The Art of Jason Heuser AKA: Sharpwriter,Brandon Kyle Fink,≤100
958164574314945,Cargill,"CARGILL, INCORPORATED",≤100
104758531061030,Christina C Wilson for Clerk of Superior Court,Christina Cochran Wilson,≤100
1083949645080409,Bob Statchen for State Senate,Robert R Statchen,≤100
108637660597586,victoria_zirkiev,These ads ran without a disclaimer,≤100
9062006483,REI,"RECREATIONAL EQUIPMENT, INC.",≤100
103846127886902,Vision for Justice,These ads ran without a disclaimer,≤100
839320036242207,Brad Trowbridge for Judge,Friends of Bradley R Trowbridge,≤100
21834534343,Volunteers of America,"VOLUNTEERS OF AMERICA, INC.",≤100
519514011556180,Dustin Marshall for DISD,Dustin Marshall for Dallas ISD,≤100
320770471620614,Sara Feigenholtz for State Senator,Citizens for Sara Feigenholtz,≤100
2162483073873761,Alaska Counts,Alaska Counts,≤100
1520483958208446,Seeger Weiss LLP,SEEGER WEISS LLP,≤100
1604364886537751,Gray Management Inc./ 336 Records Publishing,Gary Garnell Gray,≤100
97736029457,Saint Paul Public Library,Saint Paul Public Library,≤100
49651563727,Live Action,Live Action,≤100
2072089876250719,Backpage Investigation,X Social Media LLC,≤100
109020464007361,Brad Telander for Judge,Brooke E Telander,≤100
25852730092,Care2,Care2 Inc,≤100
203197030603239,8 Billion Trees,8 Billion Trees LLC,≤100
134474371753,Western Propane Gas Association,Western Propane Gas Association,≤100
296764627005582,Greg Hill For Congress,GREG HILL FOR CONGRESS,≤100
109664420557196,Scott Conklin for PA,Friends of Scott Conklin,≤100
19192438096,AAAS - The American Association for the Advancement of Science,American Association for the Advancement of Science,≤100
182242252476443,Lyn Franks For State House,Lyn Franks for State House,≤100
107623157282331,Elect Amanda Miller for Juvenile/Probate Judge,The Committee to Elect Amanda Miller Judge,≤100
108736860545663,"Bruce Karbowski Liberty County Commissioner, Pct. 1",LRT Media,≤100
19913023147,St. Mary's Food Bank,St. Mary's Food Bank Alliance,≤100
376776419037747,Turning Point USA,Turning Point USA,≤100
164869533538563,"Kalinoski Law Offices, P.C.","Kalinoski Law Offices, P.C.",≤100
117270568319993,NYSUT - A Union of Professionals,New York State United Teachers,≤100
73277646827,Trees for the Future,Trees for the Future,≤100
278799112231915,Sue-Ham,Sulondia Renice Hammond,≤100
376250065793807,Citizens for Responsible Energy Solutions,Citizens for Responsible Energy Solutions,≤100
105931860948140,Seniors Helping Seniors,These ads ran without a disclaimer,≤100
85452072376,Newsmax,Newsmax Media,≤100
971668776283950,PolicyEd,Hoover Institution,≤100
73528878871,Center for Reproductive Rights,Center for Reproductive Rights,≤100
100837844754859,Working Families for Holly Mitchell,Working Families For Holly Mitchell,≤100
102362528049222,Friday Night Jiu Jitsu,These ads ran without a disclaimer,≤100
591410131304929,Congressman John Joyce,Congressman John Joyce,≤100
1469169860057358,Academy for Professional Development Inc.,Academy for Professional Development,≤100
338530640123780,Irresistible,Focus Features,≤100
13909525938,PAAIA,PAAIA,≤100
108474767395500,Revive Great Neck Plaza,Revive Great Neck Plaza,≤100
114066205306277,Franciscan Friars of the Atonement,Franciscan Friars of the Atonement,≤100
108052197409080,tiddybartony,These ads ran without a disclaimer,≤100
152766071443309,The City University of New York,The City University of New York,≤100
165566613453452,ERLC,ETHICS AND RELIGIOUS LIBERTY COMMISSION OF THE SOUTHERN BAPTIST,≤100
648118055203804,Reset Public Affairs,RESET PUBLIC AFFAIRS LLC,≤100
211642542220470,"AARP Medicare Supplement Plans, insured by UnitedHealthcare Insurance Co.",United Healthcare,≤100
113157907700,National League of Cities,National League of Cities,≤100
1525472414388476,Better Wyoming,Better Wyoming,≤100
251632675552663,Rigged: The Voter Suppression Playbook,American Issues Initiative,≤100
273546779885377,The Gallant Pelham,"The Gallant Pelham, LLC",≤100
202286639832171,Dr. Robert Jeffress,FIRST BAPTIST CHURCH DALLAS,≤100
126929400651134,Pennsylvania Health Access Network,PA HEALTH ACCESS NETWORK,≤100
1792608671034644,The Bell Action Network,The Bell Action Network,≤100
402131763219332,James Gallagher for Assembly,Gallagher for Assembly 2020,≤100
680549575421741,UnitedVoice.com,"Beachside Media, Inc.",≤100
194079794553700,Invested Interests,Invested Interests,≤100
1990569264580772,Ryan Lee For Texas,Ryan Lee For Texas,≤100
111475477038585,Anderson + Wanca,These ads ran without a disclaimer,≤100
235182504046827,Rep. Joe Cunningham,The Office of Representative Joe Cunningham,≤100
100850364757276,Bruce Kuhn,Benjamin Roy Dorantes,≤100
113485200194181,Joey Osborne for Congress,Joey Osborne For Congress,≤100
112712083523730,Flickinger For Harris County School Trustee Position 5,Flickinger For Trustee,≤100
100644518173950,Protect South Dakota Kids,These ads ran without a disclaimer,≤100
552224034865010,Great Basin Water Network,Great Basin Water Network,≤100
46093654473,National Republican Congressional Committee,NRCC,≤100
113302310024546,Medicare for All Education Initiative - MA,Kelley Caldwell Johnson,≤100
106136417435051,Iwantmyoceanback,Iwantmyoceanback,≤100
305771790080461,Jim 2020,JIM 2020 COMMITTEE,≤100
136319594703,Texas AFT,TEXAS FEDERATION OF TEACHERS,≤100
438543526517538,Sky U. White for Hillsborough County Commission - District 3,Sky U. White for Hillsborough County Commission - District 3,≤100
534488750036661,"Ohio Value Voters, Inc.","Ohio Value Voters, Inc.",≤100
1868885156673680,Sarasota citizen Martin Hyde,Martin Hyde for Sarasota City Commission,≤100
1194865807192273,Conservative Gear,Outergoods LLC,≤100
42643626889,United Way of the Southern Tier,UNITED WAY OF SOUTHERN TIER,≤100
191817486024,60 Plus Association,60 PLUS ASSOCIATION INC,≤100
752627911745280,Elect Phillip Westry,Citizens for Phillip Westry,≤100
279610991371,Garden City Plumbing & Heating,Garden City Plumbing and Heating,≤100
106555867588908,Dustin Reavis for Stillwater Public Schools Board of Education Ward 4,Dustin Cade Reavis,≤100
10524821940,National Park Foundation,National Park Foundation,≤100
1590965647784736,CWA District 1,CWA District 1,≤100
1552030635113725,Farmingdale Village Party,Walter Priestley,≤100
106790737481410,Taylor Picone for State Representative,Picone For PA,≤100
485170385327384,Patrick Pires,These ads ran without a disclaimer,≤100
271953073708695,National Senior Benefits,National Senior Benefits,≤100
129278807814364,Welcome.,Welcome.,≤100
106859007515083,Juan Elias for 30th Ward Committeeperson,Friends for Juan Elias,≤100
373981446795978,16 Counties Coalition,Maine Momentum,≤100
916500312033578,San Antonio Patrol Service,These ads ran without a disclaimer,≤100
126499578750103,Beth Henderson,Beth for Indiana,≤100
9284565026,Bike & Build,BIKE & BUILD INC,≤100
422298691243124,Green Santa Clarita,City of Santa Clarita,≤100
28896772146,San Diego Zoo,ZOOLOGICAL SOCIETY OF SAN DIEGO,≤100
336448507217150,Chris Lewis for U.S. Congress,FRIENDS OF CHRIS LEWIS,≤100
111222097052022,KW Miller Congressional Exploratory Committee,KW Miller Congressional Exploratory Committee,≤100
262536810935097,Housing Is A Human Right,AIDS HEALTHCARE FOUNDATION,≤100
1456310534453054,Veteran Loans Online,"LMB OpCo, LLC",≤100
124955570892789,Bernie Sanders,BERNIE 2020,≤100
807585119312377,Tennesseans for Student Success,Tennesseans for Student Success,≤100
104989934291747,Allison Fine,Allison Fine for Congress,≤100
278699522729883,Pembroke News,Pembroke.NEWS,≤100
106948503990280,Pedro "Pete" Muñoz for Tarrant County Precinct 5 Constable,Joe Daniel Guerra,≤100
1434747820157997,Mark O'Loughlin for Pembroke Pines Commission,Mark O'Loughlin Campaign,≤100
255587152180,Shavitz Law Group,Paul James Herrmann,≤100
1152852928214990,Respect Big Bend,Cynthia and George Mitchell Foundation,≤100
20876805343,March of Dimes,MARCH OF DIMES INC.,≤100
223635794750555,Rep. Mike Gallagher,the Office of Rep. Mike Gallagher,≤100
5720973755,Defenders of Wildlife,DEFENDERS OF WILDLIFE,≤100
104524714451769,Little Falls Lindy Dance Team Booster Club,These ads ran without a disclaimer,≤100
116490948921544,Team Cheryl Stephens,The Team to Elect Cheryl Stephens,≤100
294440927660120,Dr. Al Olszewski for Governor,Montanans for Olszewski,≤100
146754548089,CityTeam,CityTeam,≤100
130196227157534,American Forum For Israel,American Forum for Israel,≤100
107229050703874,Bernie Sanders Fan Club,Imran M Jemal,≤100
207997082561783,Coalition for Humane Immigrant Rights,COALITION FOR HUMANE IMMIGRANT,≤100
202626512363,U.S. Census Bureau,These ads ran without a disclaimer,≤100
122411561152761,New Hampshire Automobile Dealers Association,"NEW HAMPSHIRE AUTOMOBILE DEALERS ASSOCIATION, INC.",≤100
100116151448875,David Mason,Mason for State Senate,≤100
8473889271,National Parks Conservation Association,National Parks Conservation Association,≤100
654470874584798,Save The Inventor,Innovation Alliance,≤100
158517184208081,Boulder County Democratic Party,Boulder County Democratic Party,≤100
130848666099,Business Forward,Business Forward Inc.,≤100
108519723832934,RAFT,Alexandra Marie Duany Saavedra,≤100
2317264024972785,American Populists,The New American Populist,≤100
100201718042226,Cory Eli Oshita for Cook County Circuit Judge,Support Cory Eli Oshita for Circuit Court Judge,≤100
130268756992804,Yale Climate Connections,Yale Climate Connections,≤100
108180596030668,Elizabeth Dole Foundation,Elizabeth Dole Foundation,≤100
148774365901126,Natalie Mercedes Negrotti,These ads ran without a disclaimer,≤100
112041183486666,Project Sunshine,ACRONYM,≤100
103095887825967,Jason Stoffel For Judge,Jason Stoffel,≤100
92730524910,AdventHealth,AdventHealth,≤100
48638948196,"City of Winston-Salem, NC - Government",CITY OF WINSTON-SALEM,≤100
219842411373576,Faith Mission,Lutheran Social Services of Central Ohio,≤100
176513531861,Deidre Baumann For Judge  2020,Deidre  Baumann,≤100
140357056032320,NEA Today,National Education Association,≤100
360690844706875,WinktoWebster,Wink to Webster Pipeline LLC,≤100
110274720431086,Phyllis Harvey-Hall for US House District 2,CAMPAIGN TO ELECT PHYLLIS HARVEY-HALL,≤100
108337384472,CASA,CASA,≤100
1600352356914768,PushBlack,PushBlack,≤100
110904003821748,Chris Bruns for County Commissioner,Christopher D Bruns,≤100
107165913986872,Stavros Anthony for District C,Stavros Anthony for District C,≤100
102863274537312,Antone for Congress,ANTONE FOR CONGRESS,≤100
102239794700150,Re-Elect Mike Painter Commisioner District 2,Sonja Denise Bennett,≤100
341881063685,"Imprimis, a Publication of Hillsdale College",HILLSDALE COLLEGE,≤100
113034436943044,Greg Schulte for Katy ISD Board of Trustees,Greg Schulte for Katy ISD Board of Trustees,≤100
555394394483002,Urban Resource Institute,Urban Resource Institute,≤100
289359554914740,We Have A Stake,The ANCOR Foundation,≤100
370292163393615,Mayor Dan Gelber,Miami Beach Mayor Dan Gelber,≤100
113144363390459,Andrew Knaggs,Knaggs for Congress,≤100
414336402298693,Anthony Welti for WA Insurance Commissioner 2020,Welti4WA,≤100
314499212242,Pfizer,Pfizer Inc.,≤100
1044677925719762,Coastal Illumination by Vernon Daniel Associates,These ads ran without a disclaimer,≤100
1402158953360420,"Ben Zeller, Victoria County Judge",Benjamin Lee Zeller,≤100
8111949161,ProgressNow Colorado,ProgressNow Colorado,≤100
97279934919,BP America,These ads ran without a disclaimer,≤100
328752600585098,EmblemHealth,"EMBLEMHEALTH, INC.",≤100
112721400205015,Casey Gray,CASEY GRAY FOR CONGRESS,≤100
489028831496182,Healthcare Workers Rising,Healthcare Workers Rising New York,≤100
201847089929522,Wisconsin Voices,Wisconsin Voices,≤100
254380444638509,City of Greensboro,City of Greensboro Water Resources Department,≤100
100666908166089,Jay W. Julian,Christopher Brian Cota,≤100
105953917589790,TN for Mike,Mike Bloomberg 2020 Inc,≤100
108953413953229,Adam for Idaho,Adam Joshua Frugoli,≤100
94390190938,The Tax Shop,Dennis William Futch,≤100
460844281074800,Tiny Trump,Eric D Corriel,≤100
286290521529387,Gary S. Miliefsky,These ads ran without a disclaimer,≤100
328505058010779,Local Offers and Deals,These ads ran without a disclaimer,≤100
336953649823284,Senator Ling Ling Chang,Ling Ling Chang,≤100
155690047804722,Jeanne Morales Attorney,Jeanne Marie Morales,≤100
153408513065,Democratic Party of Jefferson County (Wisconsin),Democratic Party of Jefferson County (Wisconsin),≤100
107770576043265,9-12 Project of the Lehigh Valley,"912 Project of The Lehigh Valley, Inc.",≤100
178563478969599,Valerie Cartright For Senate,Committee To Elect Valerie M. Cartright To Senate,≤100
101084211300773,Jason Kraeling for Mauldin City Council,Jason Robert Kraeling,≤100
373552550096931,Peter Burgelis for Milwaukee,Friends of Peter Burgelis,≤100
244273215652581,Friends of Scott Alvord for City Council,Friends of Scott Alvord for Roseville City Council,≤100
107616397461859,Joe Hoelscher for NEISD Trustee,Joe Hoelscher for NEISD District 4 Trustee Campaign,≤100
345577742786020,Direct Solar DFW,Direct Solar DFW,≤100
169440273093442,The Center for Election Science,The Center for Election Science,≤100
383763321729614,Paramount Hudson Valley,These ads ran without a disclaimer,≤100
169938189569,Best Buddies Challenge,"BEST BUDDIES INTERNATIONAL, INC.",≤100
100640211320183,Derek Barbee for Shelby County Sheriff,Derek Barbee For Sheriff,≤100
1762063214010161,Parks for Downtown Dallas,Collin M Quick,≤100
415210501973681,Arizona Center for Reproductive Endocrinology and Infertility,These ads ran without a disclaimer,≤100
457150451764788,Charles Navarro,NAVARRO FOR NEVADA,≤100
1155722127781939,USA Financial & Tax Services,These ads ran without a disclaimer,≤100
766893656986669,Saratoga County Libertarian Committee,Saratoga County Libertarian Committee,≤100
111270996912143,"Mickey Bohn for District Court Judge, Dept. 24",Mickey Bohn for Judge,≤100
101992031368419,Vote Steve Now for State House,Friends of Steve Leibel,≤100
150621451650636,Montana Wilderness Association,"MONTANA WILDERNESS ASSOCIATION, INC.",≤100
102587687892843,PC Realty - Pat Cochran,These ads ran without a disclaimer,≤100
143861915669489,"City of Cedar Park, Texas-City Government",City of Cedar Park,≤100
112726036750149,American Team Republicans,AMERICAN TEAM - Republican Party Shop,≤100
80562389320,NARAL Pro-Choice America,NARAL Pro-Choice America,≤100
180193808783144,iTRI 365,iTri365,≤100
2227631727458270,Raine Reusables,These ads ran without a disclaimer,≤100
313502292073176,Business Jetsetters,These ads ran without a disclaimer,≤100
178816972733611,Retirement Taxes Today,These ads ran without a disclaimer,≤100
110866592291015,Eduardo Soto Abogado Inmigracion,Eduardo Soto & Associates,≤100
111182343682003,Certified CCW,CertifiedCCW.com,≤100
350914689303,AARP Iowa,AARP,≤100
141107065924669,PPAF Pacific Southwest,Planned Parenthood Action Fund of the Pacific Southwest,≤100
106334117471036,Anbaric,Anbaric Development Partners,≤100
106099904285597,Stop NY Flip Tax,Brett E Rosenblatt,≤100
497433567299699,Overstreet 2020,Overstreet 2020,≤100
110627815623797,Minnesota Pork,Katelyn Ann Gradert,≤100
949262545154447,Spataro For Judge,Spataro for Judge Committee,≤100
778592872253670,U.S. Sugar,United States Sugar Corporation,≤100
111577036986347,James P. Rudolph for City Council 2020,James Patrick Rudolph,≤100
27981366282,Commission on Independent Colleges and Universities,Commission on Independent Colleges and Universities,≤100
136299005939,Heifer International,HEIFER PROJECT INTERNATIONAL,≤100
909917782673187,Paige Kreisman for Oregon House District 42,Committee to Elect Paige Kreisman,≤100
74593887556,Miami's Community Newspapers,Miami's Community Newspapers,≤100
