Page ID,Page Name,Disclaimer,Amount Spent (USD)﻿
456262374764387,Voters Not Politicians,Voters Not Politicians,≤100
1645269705790731,Hope For Senate,Bryan Hope for State Senate,≤100
113721910177551,Monger for Board of Directors,Thomas Wade Monger,≤100
330503870688520,Darren Bailey for State Senate 55th District,Bailey for Illinois,≤100
455752241149223,Dolcefino Consulting,Dolcefino Consulting,≤100
160389977329803,ATTN:,ATTN: INC.,≤100
107687977468815,Jackie Ward,Committee to Elect Jackie Ward for Mayor,≤100
262561993766026,Curt Bramble - Utah State Senator,Curt Bramble for State Senate,≤100
714650911882329,RSCC,Republican Senate Campaign Committee,≤100
309660569121570,"Mitch O'Connell, The World's Best Artist! By Mitch O'Connell",Mitchell R O Connell,≤100
129624603725463,America's Future Foundation,America's Future Foundation,≤100
81517275796,UNICEF USA,UNITED STATES FUND FOR UNICEF,≤100
1929286093813834,Family Friendly Economy Virginia,New Venture Fund,≤100
2022955524588789,Annette Glenn for Representative,"Annette Glenn for Michigan, PO Box 1128, Midland, MI 48641",≤100
193618220508,LIFE Today,LIFE Outreach International,≤100
15779440092,National Review,"NATIONAL REVIEW, INC.",≤100
111329240265665,Williamsburg James City County Republicans,Williamsburg James City County Republican Committee,≤100
110242800431013,Energy Independence KC,Robert Joseph Kramer,≤100
168876449866088,The Years Project,The Years Project,≤100
195338444154749,Ecolox Tech,These ads ran without a disclaimer,≤100
9132102354,E*TRADE Financial,E*TRADE,≤100
428514810671820,Democratic Central Committee of Shasta County,DEMOCRATIC CENTRAL COMMITTEE OF SHASTA COUNTY,≤100
180781279292799,Daniel La Spata for the 1st Ward,Neighbors for Daniel La Spata,≤100
342507306671372,Elect Antonio Johnson for DeKalb County Sheriff,Antonio Johnson,≤100
108228890579947,KOZ Water,Marcelle Renee Abel,≤100
115773266648124,Commissioner Frank Avila,Friends for M Frank Avila,≤100
175403889150682,FindLaw.com,FindLaw Consumer,≤100
1818591178155941,"Personal Navigator Program of VNA Community Services, Inc.",These ads ran without a disclaimer,≤100
111495005590988,Pattern,Pattern Energy,≤100
532623920123303,Elect Eric Garza for Sheriff of Cameron County,Eric  Garza,≤100
1470151473238140,Save the Boundary Waters,Northeastern MInnesotans for Wilderness,≤100
2345293012156829,Willie Jones 2020,Willie Jones 2020 Democrat for Broward County Sheriff,≤100
139362439415490,Jewish Federation of Palm Beach County,"JEWISH FEDERATION OF PALM BEACH COUNTY, INC.",≤100
152759126824,Enbridge,Enbridge Inc.,≤100
1512226022440769,League of Oil and Gas Impacted Coloradans,League of Oil and Gas Impacted Coloradans,≤100
100875044740649,Jessica Matthew for Santa Clara County Democratic Central Committee,Jessica Ann Matthew,≤100
1649500268614178,Arizona Democratic Legislative Campaign Committee,"Arizona Democratic Legislative Campaign Committee, a project of the Arizona Democratic Party. Not authorized by any candidate or candidate's committee.",≤100
510709349101737,Speak Up,SPEAK UP,≤100
382724835246339,"OKC Fraternal Order of Police, Lodge 123","Oklahoma City Fraternal Order of Police, Lodge 123",≤100
107053690842532,ABT 2020,ABT 2020,≤100
108826673978558,Our Neighborhoods Florida,Our Neighborhoods Florida,≤100
309589789079810,Lancaster County Republican Party,Lancaster County Republican Party,≤100
130270337685133,Stephen Postier,Stephen R Postier,≤100
39425446367,Planned Parenthood Central Coast Action Fund,Planned Parenthood Central Coast Action Fund,≤100
519861578414374,Lester Miller for Mayor,LESTER MILLER FOR MAYOR,≤100
105823740934304,J.D. for Prosecutor,Committee to Elect J.D. Tomlinson for Lorain County Prosecutor,≤100
106762244183809,Sam for 4,Campaign to Elect Sam for 4,≤100
180382898275,Lerner and Rowe,Lerner & Rowe Injury Attorneys,≤100
27478282874,UNITE HERE!,UNITE HERE,≤100
1357098051069442,"Cavanaugh & Thickens, LLC",These ads ran without a disclaimer,≤100
501986666647169,Chico Republican Women,Gold Star Web,≤100
692143357580562,64 Parishes,Louisiana Endowment for the Humanities,≤100
146321956085057,Lynchburg Fire Fighters Assoc. - IAFF Local 1146,Lynchburg Fire Fighters Political Action Committee,≤100
970276996399686,Elect Jevin Jensen,Committee to Elect Jevin Jensen,≤100
104514724401859,Kovack for Commissioner,Michael Stephen Kovack,≤100
19219803864,Tax Foundation,TAX FOUNDATION,≤100
309877043274761,Tod Kimmelshue for Supervisor,Kimmelshue for Supervisor 2020,≤100
332716170522025,America First Action,America First Action,≤100
993294760683044,Education Reform Now,Education Reform Now,≤100
1523403537916328,State Innovation Exchange,State Innovation Exchange (SiX),≤100
107868640615645,Paint The Ballot Blue 2020 And Beyond,Howard Rolls,≤100
1493796420756547,Santa Cruz Co Republican Club,Steven Ray Mcewen,≤100
40708428510,Environmental Advocates of New York,"ENVIRONMENTAL ADVOCATES OF NEW YORK, INC.",≤100
125631244115483,The Santa Barbara & Ventura Colleges of Law,TCS Education System,≤100
260075957396036,Campbell Wealth Management,Kelly Peter Campbell,≤100
500410440069924,Dan "Taxation Is Theft" Behrman for President 2020,COMMITTEE TO ELECT DAN TAXATION IS THEFT BEHRMAN,≤100
772624976214511,Florida Record,The Record,≤100
106325527531165,Oklahomans for Sentencing Reform,Oklahomans for Sentencing Reform,≤100
113723993386286,Brian Seaman for District Attorney,Friends of Brian Seaman,≤100
100103304676628,Michigan Herald Tribune,Michigan Herald Tribune,≤100
159449141570348,Nikiya Dodd,Friends of NIkiya Dodd,≤100
438829996186307,For Lakewood Schools,Citizens for Lakewood’s Children,≤100
429087633897093,Western Values Project,Western Values Project,≤100
1750471095167410,Trump Train News,Trump Train News,≤100
56661991371,Woods Hole Oceanographic Institution (WHOI),Woods Hole Oceanographic Institution,≤100
86134975779,Coast Guard Foundation,Coast Guard Foundation INC.,≤100
104504438466,Federal Voting Assistance Program - FVAP,Federal Voting Assistance Program (FVAP),≤100
100585598043377,Intelligent Investing Tips,Intelligent Investing Resource,≤100
427302110732180,Mike Cernovich,Michael C Cernovich,≤100
108931157277849,Fred Stevens For Sheriff,Fred Stevens for Sheriff,≤100
1384649428416342,Workers Center for Racial Justice,Center for Racial and Gender Equity,≤100
613939699097647,Vicente Peña promotor,These ads ran without a disclaimer,≤100
2043883232397356,Marlon Hill for D9,"Marlon Hill for Miami-Dade County Commissioner, District 9",≤100
109584059131553,Juan Thomas for Illinois State Representative,Juan Raudrick Thomas,≤100
125696357447716,Plaza Research--Houston,These ads ran without a disclaimer,≤100
111417456906008,Re-Elect Commissioner Meyers,Andy Meyers Campaign,≤100
107377753962841,Usha Reddi For Senate,REDDI FOR SENATE,≤100
2082869332042511,Hope4Orcas,Hope4Orcas,≤100
1913021555647128,Vintage Green Review,"Vintage Green Review, LLC",≤100
154471447959196,Institute for Veterans and Military Families - IVMF,Institute for Veterans and Military Families,≤100
107163667472070,Karen Ben-Moyal for The People's Congress 2020: Independent for TX CD-14,KAREN BEN-MOYAL,≤100
1836138529938551,Greater Half,Billy Benson,≤100
343618292379217,Planned Parenthood of Metropolitan Washington DC - PPMW,Planned Parenthood of Metropolitan Washington DC,≤100
379338692227120,Assemblyman Tom Lackey,Assemblyman Tom Lackey,≤100
200195209992441,AAZK Omaha Chapter,American Association of Zoo Keepers,≤100
104262622974259,Hollister Incorporated,Mark D Fletcher,≤100
2140339289356027,Dr. Pritesh Gandhi for Congress,GANDHI FOR TEXAS,≤100
312066286397519,Manning Asylum Law,Brian Steven Manning,≤100
530604487365010,Old Glory Flagpole Kits,Service First Flag Poles,≤100
172630052226,James Felton Keith,JFK ORGANIZERS,≤100
110314750535261,Fred Broussard for PCB City Council,Joseph Fred Broussard,≤100
1334691340028339,Hartigan for Judge,Committee To Elect Russ Hartigan Judge,≤100
104837654463416,Health Smarts,Ariel Earl Jordan,≤100
217668712261045,Michael Blichar Jr.,Friends of Michael Blichar,≤100
65364914445,Oklahoma Council of Public Affairs,"OKLAHOMA COUNCIL OF PUBLIC AFFAIRS, INC.",≤100
101003321401700,Clinton Township Yes,Clinton Township Yes,≤100
86301209824,Price Chopper Supermarkets,These ads ran without a disclaimer,≤100
190185671528558,West Central Minnesota Ducks Unlimited,"DUCKS UNLIMITED, INC.",≤100
352527958302,Israel on Campus Coalition,Israel on Campus Coalition,≤100
1441704426074372,Douglas Taurel,The American Soldier,≤100
153080620724,Donald J. Trump,TRUMP MAKE AMERICA GREAT AGAIN COMMITTEE,≤100
102410941358756,Families for Jackson Justice,Families for Jackson Justice,≤100
329574530889979,Anton Andrew for State Representative,Friends of Anton Andrew,≤100
130777800271464,Redwood Gospel Mission,REDWOOD GOSPEL MISSIONS INC,≤100
206847600571,Florida National University,These ads ran without a disclaimer,≤100
100783241291133,Valerie Starkey for Supervisor-District 2,Valerie Ann Starkey,≤100
102175748038623,Barry Mayo for City Council,Reginald Brian Jeffries,≤100
149497411782692,Galiher DeRobertis & Waxman LLP,Galiher DeRobertis Waxman,≤100
182620315479,Plan International USA,These ads ran without a disclaimer,≤100
102756811269921,Fellow Americans,Fellow Americans,≤100
494983940663155,Candice Keller,Conservatives for Candice Keller,≤100
591143641394911,Theresa Kohlhoff For Lake Oswego Mayor,Theresa for Lake Oswego Mayor,≤100
947007518669446,"Jaime M. Andrade, Jr. for IL 40th District State Representative","Friends of Jaime M. Andrade, Jr.",≤100
24999686076,Jonathan Weinzapfel,Weinzapfel for Indiana,≤100
104325844436320,US Dollar Reports,US Dollar Reports,≤100
195155184265445,Choosing Clean Energy: A Campaign of The Nature Conservancy,Nature Conservancy,≤100
252868826461,American Cancer Society Cancer Action Network of Kansas ACS CAN,AMERICAN CANCER SOCIETY CANCER ACTION NETWORK INC,≤100
105101977683813,BJ Kreseen for Meigs County Treasurer,Vicki Dawn Smith,≤100
1643252102629753,Vote Wayne R. Posner,"Wayne R. Posner for Jupiter Town Council, District 1.",≤100
168372999850740,Christopher Sign ABC 33/40,These ads ran without a disclaimer,≤100
101455931403422,Support WE Schools,Willoughby Eastlake Levy Committee,≤100
104499437823630,Winner Takes All,Winner Takes All WTA,≤100
522459191276087,Prenda,Prenda,≤100
466164103423147,Thorn,Thorn with Facebook Ad Credits,≤100
83582488650,askhrgreen.org,askHRgreen,≤100
110301267123707,Benton Franklin Census 2020,These ads ran without a disclaimer,≤100
674745832614465,Illinois State AFL-CIO,ILLINOIS STATE AFL CIO,≤100
119378802790672,North Dakota Census 2020,North Dakota Department of Commerce,≤100
801128873366678,Darlington County Republican Party,Diane Marie Delucia,≤100
1830454113922110,GOBartlesville,Michael Wayne Wray,≤100
106438594282514,TrumpTrain2020.Store,Trumptrain2020.store,≤100
193985315942,Friends of Iris Y. Martinez,Iris for Cook County Circuit Court Clerk,≤100
376695479838990,CrowdSourced Politics,Anthony Charles Straine,≤100
386161758665696,Rich Finneran,Finneran for Missouri,≤100
182620315479,Plan International USA,Plan International USA,≤100
104722921053215,Kim Mahoney for Racine County Supervisor,Kimberly A Mahoney,≤100
440144889337112,Chicago Immigration Advocates Law Offices,Chicago Immigration Advocates Law Offices,≤100
427290978110426,Backpage Trafficking,X Social Media LLC,≤100
1888806214722917,Erie County Anti-Stigma Coalition,Erie County Anti-Stigma Coalition,≤100
111032923803385,Revitalize Arizona,Revitalize Arizona,≤100
108209810736254,Dave for Dacula,David James Slotter,≤100
839930242705074,Moore County GOP,Stephen Woodward,≤100
1664959567149320,Wholesome Culture,Wholesome Culture,≤100
725628997568701,Dan Pope,Dan Pope for Mayor Campaign,≤100
114278916779762,Vote Drew Brickson for Petal Alderman at Large,Andrew Brickson,≤100
109698983847491,Vote Texas,Vote Texas PAC,≤100
141692255929599,Democratic Socialists of America,DEMOCRATIC SOCIALISTS OF AMERICA INC,≤100
1533010070325272,Martell for Manitowoc,Tyler Thomas Martell,≤100
100858674763711,Westport Bars,These ads ran without a disclaimer,≤100
118502801658228,Young Kim,Young Kim for Congress,≤100
1693434857606381,Cathy Williams MCSD,Committee to Re-Elect Cathy Williams,≤100
6240652407,Young America's Foundation,YOUNG AMERICA'S FOUNDATION INC,≤100
300125763392341,Bigger Pie Forum,Bigger Pie Forum,≤100
90114821733,St. Johns River Water Management District,ST JOHNS RIVER WATER MANAGEMENT DISTRICT,≤100
102619234665360,Rosenquest for Mayor,Christopher Charles Rosenquest,≤100
103872214539163,Milpitas For La Quinta,These ads ran without a disclaimer,≤100
115368866575567,DrKim4TX,Antron Derrell Johnson,≤100
111081520484889,Restoring Oaks,Thomas Michael Nettesheim,≤100
19575923823,Farm Sanctuary,"Farm Sanctuary, Inc.",≤100
163281721906,Vail Valley Partnership,VAIL VALLEY PARTNERSHIP,≤100
376868783115532,"Chris Ward for State Assembly, 78th Dist",CHRIS WARD FOR ASSEMBLY 2020,≤100
145687912131213,"City of Olathe, KS Government",City of Olathe,≤100
13885075114,Action Against Hunger USA,ACTION AGAINST HUNGER - USA,≤100
162815323592,Massachusetts Nonprofit Network,"Massachusetts Nonprofit Network, Inc.",≤100
113710536757414,Arizona Signatures,Arizona Signatures,≤100
112179098816942,Congressman Ted Deutch,Congressman Ted Deutch,≤100
357752227940750,Wasatch Speaker Series,Eminent Series Group,≤100
950931225115507,American Warfighters,These ads ran without a disclaimer,≤100
775617259208598,JobHat.com,These ads ran without a disclaimer,≤100
108641917392578,Holly Cobb for Board of Education,Holly Cobb for Board of Education,≤100
113092800329357,Friends of Barbers Hill ISD,Friends of Barbers Hill ISD,≤100
109477057219125,Christine Win for Clayton School Board,Christine Louise Win,≤100
884081075319643,Morgan Harper for Congress,MORGAN HARPER FOR CONGRESS,≤100
347649111931483,Jim Carpenter,James Blair Carpenter,≤100
91825280193,Osceola County,These ads ran without a disclaimer,≤100
2215936995384536,Justice Cynthia Cobbs for Supreme Court of IL,Committee to Elect Justice Cynthia Y. Cobbs,≤100
265091094057597,Americans For Carbon Dividends,Americans for Carbon Dividends Inc,≤100
108799737374382,Costa Mesa Proud,Gary Wayne Lawson,≤100
227385377272285,Brawny Towels,These ads ran without a disclaimer,≤100
292351509697,Jerusalem Prayer Team,Jerusalem Prayer Team,≤100
32802137652,Keystone Progress,Keystone Progress,≤100
107803180821192,Elect Sarah Oerther,Sarah Eileen Oerther,≤100
130965453649891,Morris County Republican Committee,Morris County Republican Committee,≤100
107616720757744,Mike Navarre for Sheriff,Navarre for Sheriff,≤100
209516845093,NRDC Action Fund,NRDC Action Fund,≤100
475456956305422,All Voting Is Local,The Leadership Conference on Civil and Human Rights,≤100
489163527877026,Plastics Industry Association,Plastics Industry Association Inc,≤100
108250814041519,Idaho Patient Act,"MELALEUCA, INC.",≤100
101938519186,Zoe Boekbinder,Zoe Boekbinder LLC,≤100
106328384169872,Monterey Park Proud,Proud Digital Media,≤100
1609349729157998,Will Espero for Hawaii,Cedric Rekoi Duarte,≤100
2090570041197499,Re-Elect Alderman Tom Tunney,Citizens for Tunney,≤100
1438553336457672,Fair Housing Council of Greater San Antonio,SAN ANTONIO FAIR HOUSING COUNCIL INC,≤100
466472636886780,Tangipahoa Parish Government,Tangipahoa Parish Government,≤100
37892661587,JDC,JDC,≤100
1639580672939851,Tony McCombie,McCombie for Illinois,≤100
107481860660975,Fatima Iqbal-Zubair for State Assembly 64,Fatima Iqbal-Zubair for Assembly 2020,≤100
218453741583460,Rep. Ed Osienski,Delaware House Democratic Caucus,≤100
774414356083276,Retirement 101 Workshops,101 Workshops,≤100
48570030993,The Lanier Law Firm,Grace Lamb,≤100
103636294535112,Libertarian Party of UNCG,Joseph Timothy Swiggett,≤100
107904733908466,Securing Our Future,Securing Our Future,≤100
1571401929773000,North County  Climate Change Alliance,North County Climate Change Alliance,≤100
192448150001,Jeff Anderson & Associates,Jeffrey R Anderson PA,≤100
190400207672014,American Bankers Association,American Bankers Association,≤100
108790689218537,Idaho Republican Party,Idaho Republican Party,≤100
215710880194,VidaySalud.com,HITN - Hispanic Information and Telecommunications Network,≤100
169124877249,AARP Virginia,AARP,≤100
50540749125,International Orthodox Christian Charities,"INTERNATIONAL ORTHODOX CHRISTIAN CHARITIES, INC.",≤100
101663268048421,Shas Olami,These ads ran without a disclaimer,≤100
106537330974631,California ICenter,These ads ran without a disclaimer,≤100
110828597147771,Annapolis Coalition of Black Progressives,Annapolis Coalition of Black Progressives PAC,≤100
372353822835252,Planned Parenthood of Greater Texas,These ads ran without a disclaimer,≤100
15771560300,Earthjustice,EARTHJUSTICE,≤100
1586060554780670,Marsy's Law for Iowa,"Marsy’s Law for Iowa, LLC",≤100
1651938015128584,Georgians for Lawsuit Reform,Georgians for Lawsuit Reform,≤100
204623453392865,Angelica Dueñas for Congress - CA29,ANGELICA DUENAS FOR CONGRESS 2020,≤100
290619938124217,TropicSport,Chase Keola Sagum,≤100
102330281223041,Tradewater,"Tradewater, LLC",≤100
8532248414,Wounded Warrior Project,"WOUNDED WARRIOR PROJECT, INC.",≤100
104014827702461,Jaramillo For Congress TX-17,Samuel Burton Gostomski,≤100
108143020790092,"Kiwanis Club of Scott, Louisiana",Kiwanis International,≤100
256253931114914,1 on 1 Matchmaking,One on One Matchmaking,≤100
219886468037083,West Texas Food Bank,WEST TEXAS FOOD BANK,≤100
43287633515,Alliance for Climate Education,Alliance for Climate Education,≤100
124966805563833,Robert H. Stansfield for Superior Court Judge,"Committee to Elect Robert H. Stansfield, Inc",≤100
105036184333498,Vote For Fred Whiteman,Fred Dewitt Whiteman Jr,≤100
183517831660100,Morning Consult,Morning Consult LLC,≤100
108687773798767,"Shut Down DC-Climate Strike Washington, DC",DC Action Fund Corporation,≤100
910297582349535,Cory Briggs for City Attorney,Cory Briggs for City Attorney 2020,≤100
477913722749311,Virginia Beach Council of Civic Organizations Inc,Virginia Beach Council of Civic Organizations,≤100
105281287589788,San Bernardino County Gun Owners - SBGunOwners,San Bernardino County Gun Owners PAC,≤100
6165653060,AFSCME,AMERICAN FEDERATION OF STATE COUNTY & MUNICIPAL EMPLOYEES,≤100
59687083274,UCSB Arts & Lectures,UCSB Arts & Lectures,≤100
573084822773932,Joe Perkins for Circuit Judge Campaign Committee,Joe Perkins for Circuit Judge Campaign Committee,≤100
117127731647232,Clean Energy California,Energy Media,≤100
524700097675926,Virginia Hospital & Healthcare Association,Virginia Hospital & Healthcare Association,≤100
1156426531205011,Mailboxmascots,Jonathan Hall,≤100
186703441342317,SAMMinistries-Overcoming Homelessness,SAMMinistries,≤100
114386721939978,The Made in America Store,Made In America Store,≤100
118737467661,New York State Department of Labor,New York State Department of Labor,≤100
112933493402539,Friends of Jawaharial "Omar" Williams,Nyajai Ellison,≤100
1701899883357807,Seed Your Future,Seed Your Future,≤100
213998472307,Hoosier Environmental Council,"HOOSIER ENVIRONMENTAL COUNCIL, INC",≤100
563170183888903,Betty Griffin Center Thrift Shoppe,Betty Griffin Center Thrift Shoppes,≤100
145380305523723,Secure America Now,Secure America Now,≤100
596556607135301,The Earthling Co.,Educated Earthling,≤100
103438327698577,Ryan Williams for Denton County Commissioner,Friends of Ryan Williams,≤100
101617224555221,Nancy Pelosi Elects Democrats,PAC TO THE FUTURE,≤100
1268410219898273,Tango Tango,Tango Tango Inc,≤100
27544763621,Prison Fellowship,Prison Fellowship,≤100
503856713022335,Nav,These ads ran without a disclaimer,≤100
515416298618293,John Peschong for Supervisor,John Peschong for Supervisor 2020,≤100
309798029121030,Everytown for Gun Safety,Everytown for Gun Safety Action Fund Inc,≤100
6204742571,Sierra Club,SIERRA CLUB,≤100
101732681294404,Carbon Free New York,Carbon Free New York,≤100
358626908250581,CleanEnergy4NJ,Energy Media,≤100
107706927308221,Lui Bautista 4 City Council 2020,Lui Bautista,≤100
2424953184233687,Lane McConnell for Branson School Board 2020,Susan L Mcconnell,≤100
572946842722169,Jake LaTurner,KANSANS FOR LATURNER,≤100
328065780936817,Forest Fire Facts,Forest Fire Facts,≤100
108514693875761,Lauren Young for 1st Ward Committeeperson,Friends for Lauren Young,≤100
2327804674136406,We Drive Progress,SEIU 1021,≤100
1379563585404952,Trump National Golf Club Bedminster,These ads ran without a disclaimer,≤100
181924628560212,SumOfUs,SumOfUs,≤100
154643041146,ANCA Western Region,Armenian National Committee of America - Western Region,≤100
107803440835562,US Hot Gears,Click Wonders,≤100
6756153498,Mike Bloomberg,Mike Bloomberg 2020 Inc,≤100
240021803095684,Valiant Baptist Church,Tyler Dean Baker,≤100
525171637666780,Sandy Piña California Delegate,RCR,≤100
416991872213134,Iowa Voices,Iowa Forward,≤100
113714890038421,Jeff Fleming for Illinois State Senate 55th District,Jeffrey E Fleming,≤100
604035599637850,Apex Solar Power,These ads ran without a disclaimer,≤100
146944270368,Senator Larry Grooms,LARRY GROOMS FOR SENATE,≤100
201287297283968,Representative Frank Fleming,"Fleming For Legislature. 626 South 38th Street West #22, Billings, MT 59102. Republican",≤100
15041226930,Oxfam,"OXFAM AMERICA, INC.",≤100
102782516806826,Kindle Books By Joe Dacy,Joe  Dacy,≤100
560720844354559,Minority Humanitarian Foundation,Mark Albert Lane,≤100
111198783748504,Elect Judge Trevino,Elect Judge Trevino,≤100
133855567312842,Scott Lively Ministries,Scott D Lively,≤100
102311291365182,3M Claim Hub,These ads ran without a disclaimer,≤100
115384743346886,Michael DeHaven for Iola School Board,Michael D Dehaven,≤100
969318013158605,Miami-Dade Limestone Prod Association,Miami-Dade Limestone Products Association,≤100
21492729544,Catholic Relief Services,CATHOLIC RELIEF SERVICES - UNITED STATES CONFERENCE OF CATHOLIC BISHOPS,≤100
218721288205051,Thomas Massie,Thomas Massie for Congress,≤100
101070641452406,Seamus Garrity for Central Committee,Seamus Garrity for Central Committee,≤100
104190161088262,Let SC Decide,Let SC Decide,≤100
540815142931265,Reggie Goco,These ads ran without a disclaimer,≤100
10423517786,Harvard Business Review,HARVARD BUSINESS SCHOOL PUBLISHING CORPORATION,≤100
110211287060311,Fanon Rucker for Prosecutor,Committee to Elect Fanon Rucker,≤100
195301784540277,coastalteesfashion,These ads ran without a disclaimer,≤100
100405956709980,Concerned Citizens for Nuclear Safety (CCNS),CONCERNED CITIZENS FOR NUCLEAR SAFETY,≤100
521010658436453,Mike Ghassali For Congress,GHASSALI FOR CONGRESS,≤100
296001947124021,John Orem for Berkeley County Sheriff,John Orem For Sheriff,≤100
126660277417565,Engage Michigan,Engage Michigan,≤100
159559168787,"The Chai Center - Dix Hills, NY Jewish Center",CHABAD LUBAVITCH CHAI CENTER INC,≤100
167418116629106,Austin Street Center,SHELTER MINISTRIES OF DALLAS,≤100
2222159294727972,Rep. Anthony Brindisi,Rep. Anthony Brindisi,≤100
173709052662746,"American Heart Association, Palm Beach County","American Heart Association, Inc.",≤100
524526161074907,860 AM The Answer,Salem Media,≤100
59254639983,Boston Medical Center,BOSTON MEDICAL CENTER,≤100
1879985012271313,DEMWINS-Democratic Women's Issues Network,Austin Dale Smith,≤100
103894551023545,Aileen Bhandari for Judge,Aileen Bhandari for Judge,≤100
1471192629573866,Brian Livingston for Frisco,Robert Brian Livingston,≤100﻿
947055948683779,Storus,Mia Kaminski,≤100
525250180928707,Anthony Gulluni for District Attorney,The Committee to Elect Anthony Gulluni,≤100
574251066047657,CVIIC,Central Valley Immigrant Integration Collaborative,≤100
109369307095671,Friends to Elect Julie B. Aimen for Judge from the 9th Judicial Subcircuit,Friends to Elect Julie B. Aimen for Judge,≤100
181994851877502,Goodwill Industries of Central Oklahoma,Goodwill Industries of Central Oklahoma,≤100
527517893943355,Worldstrong Athletics,Worldstrong Athletics,≤100
105446074359028,Cancel Conway,VOTE LIBERATION,≤100
532567290599890,Dan McEntire for State Senate,Dan McEntire for State Senate,≤100
120372738138649,LG&E and KU,LG&E and KU,≤100
189728837873260,Spectrum 360 Radio Program,Mark Anthony Skogman,≤100
38471053686,Elizabeth Warren,"WARREN FOR PRESIDENT, INC.",≤100
110092947125775,Franklin County Democrats United,Franklin County Democrats United,≤100
543862072448211,Montclair Proud,Proud Digital Media,≤100
101624321445953,Garrett Blad for State Rep,Blad for Indiana,≤100
1608037099452838,Brianna Wu,BRIANNA WU FOR CONGRESS,≤100
110712787117332,Elect Greg Free for Bartow County Coroner,Greg Winston Free,≤100
472707749570927,Oncata,Oncata Inc,≤100
110177119192569,Knightscope,William Li,≤100
232906983523858,The Philadelphia Citizen,The Philadelphia Citizen,≤100
627951147293090,FatFinger,Fat Finger LLC,≤100
129038841261426,Energy Consumers of the Carolinas,Energy Consumers of the Carolinas Inc,≤100
1440505399590209,Phillip DeVillier,"YourVote, LLC",≤100
353682792005802,Heather Mulligan Begley for Judge,Committee to Elect Heather Begley for Judge,≤100
184040026329,Jon Hardister,Jon Hardister for NC House,≤100
1864721517082089,Democratic Attorneys General Association,Democratic Attorneys General Association,≤100
1852520761657982,4ocean,4ocean,≤100
583648525060535,"Libertarian Party of Clark County, Nevada",Steven Brown,≤100
